{
  "name": "generous-ui",
  "version": "0.1.0",
  "style": "generous-clarity",
  "description": "Opinionated React UI primitives for clear, stable, human-scale interfaces.",
  "css": "src/styles.css",
  "components": [
    { "name": "ActionBar", "type": "pattern", "files": ["src/patterns/action-bar.tsx"] },
    { "name": "EmptyState", "type": "pattern", "files": ["src/patterns/empty-state.tsx"] },
    { "name": "PageShell", "type": "pattern", "files": ["src/patterns/page-shell.tsx"] },
    { "name": "AppFrame", "type": "pattern", "files": ["src/patterns/app-frame.tsx"] },
    { "name": "AppHeader", "type": "pattern", "files": ["src/patterns/app-header.tsx"] },
    { "name": "AppFooter", "type": "pattern", "files": ["src/patterns/app-footer.tsx"] },
    { "name": "Accordion", "type": "display", "files": ["src/components/accordion.tsx"] },
    { "name": "Alert", "type": "feedback", "files": ["src/components/alert.tsx"] },
    { "name": "AlertDialog", "type": "feedback", "files": ["src/components/alert-dialog.tsx"] },
    { "name": "AreaChart", "type": "data", "files": ["src/components/area-chart.tsx"] },
    { "name": "ActionLink", "type": "control", "files": ["src/components/action-link.tsx"] },
    { "name": "AccessList", "type": "trust", "files": ["src/components/access-list.tsx"] },
    { "name": "ActivityLog", "type": "data", "files": ["src/components/activity-log.tsx"] },
    { "name": "AspectRatio", "type": "display", "files": ["src/components/aspect-ratio.tsx"] },
    { "name": "Avatar", "type": "display", "files": ["src/components/avatar.tsx"] },
    { "name": "BarChart", "type": "data", "files": ["src/components/bar-chart.tsx"] },
    { "name": "Badge", "type": "display", "files": ["src/components/badge.tsx"] },
    { "name": "BulkActionBar", "type": "control", "files": ["src/components/bulk-action-bar.tsx"] },
    { "name": "Breadcrumbs", "type": "navigation", "files": ["src/components/breadcrumbs.tsx"] },
    { "name": "BreadcrumbSlot", "type": "navigation", "files": ["src/components/breadcrumbs.tsx"] },
    { "name": "Button", "type": "control", "files": ["src/components/button.tsx"] },
    { "name": "IconButton", "type": "control", "files": ["src/components/button.tsx"] },
    { "name": "ButtonGroup", "type": "control", "files": ["src/components/button-group.tsx"] },
    { "name": "CalendarMonth", "type": "display", "files": ["src/components/calendar-month.tsx"] },
    { "name": "Card", "type": "display", "files": ["src/components/card.tsx"] },
    { "name": "Checkbox", "type": "form", "files": ["src/components/checkbox.tsx"] },
    { "name": "CheckboxField", "type": "form", "files": ["src/components/checkbox.tsx"] },
    { "name": "CharacterCount", "type": "form", "files": ["src/components/character-count.tsx"] },
    { "name": "ChangeReview", "type": "display", "files": ["src/components/change-review.tsx"] },
    { "name": "ChoiceTile", "type": "control", "files": ["src/components/choice-tile.tsx"] },
    { "name": "CodeBlock", "type": "data", "files": ["src/components/code-block.tsx"] },
    { "name": "Collapsible", "type": "display", "files": ["src/components/collapsible.tsx"] },
    { "name": "ComparisonList", "type": "display", "files": ["src/components/comparison-list.tsx"] },
    { "name": "Combobox", "type": "form", "files": ["src/components/combobox.tsx"] },
    { "name": "ConfidencePanel", "type": "trust", "files": ["src/components/confidence-panel.tsx"] },
    { "name": "Command", "type": "control", "files": ["src/components/command.tsx"] },
    { "name": "ConfirmationPanel", "type": "feedback", "files": ["src/components/confirmation-panel.tsx"] },
    { "name": "ContextActions", "type": "control", "files": ["src/components/context-actions.tsx"] },
    { "name": "ConsentPanel", "type": "trust", "files": ["src/components/consent-panel.tsx"] },
    { "name": "ContrastPair", "type": "data", "files": ["src/components/contrast-pair.tsx"] },
    { "name": "CopyField", "type": "form", "files": ["src/components/copy-field.tsx"] },
    { "name": "DataTable", "type": "data", "files": ["src/components/data-table.tsx"] },
    { "name": "DataUseList", "type": "trust", "files": ["src/components/data-use-list.tsx"] },
    { "name": "DateField", "type": "form", "files": ["src/components/date-time-field.tsx"] },
    { "name": "TimeField", "type": "form", "files": ["src/components/date-time-field.tsx"] },
    { "name": "DatePicker", "type": "form", "files": ["src/components/date-picker.tsx"] },
    { "name": "DetailPanel", "type": "display", "files": ["src/components/detail-panel.tsx"] },
    { "name": "DecisionList", "type": "control", "files": ["src/components/decision-list.tsx"] },
    { "name": "DescriptionList", "type": "data", "files": ["src/components/description-list.tsx"] },
    { "name": "ConfirmDialogFooter", "type": "feedback", "files": ["src/components/dialog.tsx"] },
    { "name": "Dialog", "type": "feedback", "files": ["src/components/dialog.tsx"] },
    { "name": "ErrorSummary", "type": "feedback", "files": ["src/components/error-summary.tsx"] },
    { "name": "EvidenceList", "type": "trust", "files": ["src/components/evidence-list.tsx"] },
    { "name": "FileDrop", "type": "form", "files": ["src/components/file-drop.tsx"] },
    { "name": "FieldGroup", "type": "form", "files": ["src/components/field-group.tsx"] },
    { "name": "FilterChips", "type": "form", "files": ["src/components/filter-chips.tsx"] },
    { "name": "FilterSummary", "type": "display", "files": ["src/components/filter-summary.tsx"] },
    { "name": "FormField", "type": "form", "files": ["src/components/input.tsx"] },
    { "name": "Input", "type": "form", "files": ["src/components/input.tsx"] },
    { "name": "Textarea", "type": "form", "files": ["src/components/input.tsx"] },
    { "name": "InputGroup", "type": "form", "files": ["src/components/input-group.tsx"] },
    { "name": "HelpHint", "type": "display", "files": ["src/components/help-hint.tsx"] },
    { "name": "HumanReviewPanel", "type": "trust", "files": ["src/components/human-review-panel.tsx"] },
    { "name": "InsetNotice", "type": "display", "files": ["src/components/inset-notice.tsx"] },
    { "name": "InlineEdit", "type": "form", "files": ["src/components/inline-edit.tsx"] },
    { "name": "InvitePanel", "type": "trust", "files": ["src/components/invite-panel.tsx"] },
    { "name": "Item", "type": "display", "files": ["src/components/item.tsx"] },
    { "name": "ItemGroup", "type": "display", "files": ["src/components/item.tsx"] },
    { "name": "JobQueue", "type": "display", "files": ["src/components/job-queue.tsx"] },
    { "name": "LineChart", "type": "data", "files": ["src/components/line-chart.tsx"] },
    { "name": "ListRow", "type": "display", "files": ["src/components/list-row.tsx"] },
    { "name": "LoadingRegion", "type": "feedback", "files": ["src/components/loading-region.tsx"] },
    { "name": "MediaSlot", "type": "display", "files": ["src/components/media-slot.tsx"] },
    { "name": "Menu", "type": "control", "files": ["src/components/menu.tsx"] },
    { "name": "MenuBar", "type": "control", "files": ["src/components/menu-bar.tsx"] },
    { "name": "Meter", "type": "data", "files": ["src/components/meter.tsx"] },
    { "name": "NavigationMenu", "type": "navigation", "files": ["src/components/navigation-menu.tsx"] },
    { "name": "NavigationList", "type": "navigation", "files": ["src/components/navigation-list.tsx"] },
    { "name": "NativeSelect", "type": "form", "files": ["src/components/native-select.tsx"] },
    { "name": "Pagination", "type": "navigation", "files": ["src/components/pagination.tsx"] },
    { "name": "PageTabs", "type": "navigation", "files": ["src/components/page-tabs.tsx"] },
    { "name": "PasswordField", "type": "form", "files": ["src/components/password-field.tsx"] },
    { "name": "PermissionPanel", "type": "trust", "files": ["src/components/permission-panel.tsx"] },
    { "name": "Popover", "type": "control", "files": ["src/components/popover.tsx"] },
    { "name": "PresenceList", "type": "display", "files": ["src/components/presence-list.tsx"] },
    { "name": "Progress", "type": "feedback", "files": ["src/components/progress.tsx"] },
    { "name": "QualityChecklist", "type": "trust", "files": ["src/components/quality-checklist.tsx"] },
    { "name": "RadioGroup", "type": "form", "files": ["src/components/radio-group.tsx"] },
    { "name": "ResultList", "type": "display", "files": ["src/components/result-list.tsx"] },
    { "name": "RequirementList", "type": "trust", "files": ["src/components/requirement-list.tsx"] },
    { "name": "ReleaseGate", "type": "trust", "files": ["src/components/release-gate.tsx"] },
    { "name": "ResizablePanels", "type": "layout", "files": ["src/components/resizable-panels.tsx"] },
    { "name": "RetryPanel", "type": "feedback", "files": ["src/components/retry-panel.tsx"] },
    { "name": "Kbd", "type": "data", "files": ["src/components/kbd.tsx"] },
    { "name": "NumberStepper", "type": "form", "files": ["src/components/number-stepper.tsx"] },
    { "name": "OtpInput", "type": "form", "files": ["src/components/otp-input.tsx"] },
    { "name": "SectionBreak", "type": "display", "files": ["src/components/section-break.tsx"] },
    { "name": "SearchField", "type": "form", "files": ["src/components/search-field.tsx"] },
    { "name": "SaveStatus", "type": "feedback", "files": ["src/components/save-status.tsx"] },
    { "name": "SegmentedControl", "type": "form", "files": ["src/components/segmented-control.tsx"] },
    { "name": "Select", "type": "form", "files": ["src/components/select.tsx"] },
    { "name": "SelectionList", "type": "form", "files": ["src/components/selection-list.tsx"] },
    { "name": "ShareSummary", "type": "trust", "files": ["src/components/share-summary.tsx"] },
    { "name": "Sidebar", "type": "navigation", "files": ["src/components/sidebar.tsx"] },
    { "name": "ShortcutList", "type": "display", "files": ["src/components/shortcut-list.tsx"] },